{"schemaVersion":"2.0.0","generatedAt":"2026-10-09T19:21:21-04:00","editionDate":"2026-10-09","events":[{"legacyOccurrenceKeys":["hearth-summit-detroit-event-2026-10-08|2026-10-08T00:00:00-04:00"],"legacySeriesKeys":["hearth summit detroit|kintsugi village detroit"],"timePrecision":"date","id":"occ-7485a50ba983fcb36a2223b0","occurrenceId":"occ-7485a50ba983fcb36a2223b0","title":"Hearth Summit Detroit","url":"https://community.metrotimes.com/event/hearth-summit-detroit-41913450","start":"2026-10-08T00:00:00-04:00","end":"2026-10-10T00:00:00-04:00","venue":"Kintsugi Village Detroit","city":"Detroit","category":"Self-care","summary":"Hearth Summit Detroit is grounded in the city’s creativity, resilience, and collective spirit and is designed to bring together 200 social entrepreneurs, educators, artists, funders, mental health and holistic practitioners, and more working toward a more just and equitable society. The summit aims to deepen reflection across individual, collective, and ecological wellbeing while centering art as a shared language of healing and connection.","score":88,"scoring":{"signals":{"funny":0.06,"distinctive":0.63,"eclectic":0.86,"technical_science":0.06,"artsy":0.95,"progressive":0.92,"outdoors":0.05,"theatre":0.03,"live_music":0.03,"live_comedy":0.02,"farmer_market":0.02,"sporting":0.02,"recurring":0.13,"craft_fair_shopping":0.03,"religious":0.05,"large_venue":0.05,"substance_recovery":0.04,"popular_music_cover_band":0.02,"market_or_shop":0.02,"punk_metal_or_rock":0.02,"dance":0.03,"sales_related":0.1,"children_activity":0.03,"running":0.01,"exercise":0.03,"employment_related":0.04},"score":88,"rulesVersion":2},"registration":"https://www.hearthsummitdetroit.com/interest","status":"scheduled","localityTier":"regional"},{"legacyOccurrenceKeys":["big-fun-murder-an-improvised-murder-myst-event-2026-10-09|2026-10-09T21:30:00-04:00","src-005a4759b33c878fb6683cb7|2026-10-09T21:30:00-04:00"],"legacySeriesKeys":["big fun murder | an improvised murder mystery|go comedy! improv theater"],"timePrecision":"time","id":"occ-77253682399c2156feaab9c1","occurrenceId":"occ-77253682399c2156feaab9c1","title":"Big Fun Murder | An Improvised Murder Mystery","url":"https://community.metrotimes.com/event/big-fun-murder-an-improvised-murder-mystery-42073855","start":"2026-10-09T21:30:00-04:00","end":"2026-11-06T21:30:00-05:00","venue":"Go Comedy! Improv Theater","city":"Ferndale","category":"Improv","summary":"Immersive murder mystery improv show with 5 different eras and new victims each night at Go Comedy! Improv Theater. New costumes and themes every Friday in October.","score":100,"scoring":{"signals":{"funny":0.97,"distinctive":0.76,"eclectic":0.51,"technical_science":0.02,"artsy":0.97,"progressive":0.21,"outdoors":0.02,"theatre":0.9,"live_music":0.02,"live_comedy":0.98,"farmer_market":0.01,"sporting":0.02,"recurring":0.91,"craft_fair_shopping":0.01,"religious":0.01,"large_venue":0.02,"substance_recovery":0.01,"popular_music_cover_band":0.02,"market_or_shop":0.01,"punk_metal_or_rock":0.02,"dance":0.02,"sales_related":0.7,"children_activity":0.03,"running":0.01,"exercise":0.01,"employment_related":0.01},"score":100,"rulesVersion":2},"price":"$20","registration":"https://tinyurl.com/BFMatGo","status":"scheduled","localityTier":"unknown"},{"legacyOccurrenceKeys":["fay-victor-s-herbie-nichols-sung-event-2026-10-10|2026-10-10T22:00:00-04:00"],"legacySeriesKeys":["fay victor's herbie nichols sung|kerrytown concert house"],"timePrecision":"time","id":"occ-31fe4d88097b84133631714c","occurrenceId":"occ-31fe4d88097b84133631714c","title":"Fay Victor's Herbie Nichols SUNG","url":"https://kerrytownconcerthouse.com/event/edgefest-30-freedom-at-the-edge","start":"2026-10-10T22:00:00-04:00","venue":"Kerrytown Concert House","city":"Ann Arbor","category":"Music","summary":"A performance featuring Fay Victor (voice, lyrics & conceptualist), Anthony Coleman (piano), Devon Gates (bass), and Tom Rainey (drums) as part of Edgefest 30. Sponsored by Keith Martin and Michael Starsinic.","score":100,"scoring":{"signals":{"funny":0.11,"distinctive":0.79,"eclectic":0.73,"technical_science":0.04,"artsy":0.99,"progressive":0.85,"outdoors":0.02,"theatre":0.11,"live_music":0.97,"live_comedy":0.02,"farmer_market":0.01,"sporting":0.01,"recurring":0.08,"craft_fair_shopping":0.02,"religious":0.02,"large_venue":0.03,"substance_recovery":0.01,"popular_music_cover_band":0.1,"market_or_shop":0.02,"punk_metal_or_rock":0.04,"dance":0.02,"sales_related":0.22,"children_activity":0.02,"running":0.01,"exercise":0.01,"employment_related":0.01},"score":100,"rulesVersion":2},"registration":"https://kerrytownconcerthouse.my.salesforce-sites.com/ticket/#/instances/a0FUP000008OOcT2AW","status":"scheduled","localityTier":"regional"},{"legacyOccurrenceKeys":["rocky-horror-picture-show-viewing-experi-event-2026-10-10|2026-10-10T23:15:00-04:00","src-54f64e4c6c1f82d4ac953a95|2026-10-10T23:15:00-04:00"],"legacySeriesKeys":["rocky horror picture show viewing experience|state wayne theatre"],"timePrecision":"time","id":"occ-c546ba86579bfa0aa7e51d8a","occurrenceId":"occ-c546ba86579bfa0aa7e51d8a","title":"Rocky Horror Picture Show Viewing Experience","url":"https://community.metrotimes.com/event/rocky-horror-picture-show-viewing-experience-8505882","start":"2026-10-10T23:15:00-04:00","end":"2026-10-11T02:30:00-04:00","venue":"State Wayne Theatre","city":"Wayne","category":"Screening","summary":"Second and Fourth Saturday of every month, 11:15 p.m.-2:30 a.m. at State Wayne Theatre. Screening and audience participation shadow cast. $10.","score":99,"scoring":{"signals":{"funny":0.9,"distinctive":0.77,"eclectic":0.63,"technical_science":0.03,"artsy":0.96,"progressive":0.71,"outdoors":0.01,"theatre":0.18,"live_music":0.05,"live_comedy":0.06,"farmer_market":0.01,"sporting":0.01,"recurring":0.99,"craft_fair_shopping":0.01,"religious":0.02,"large_venue":0.04,"substance_recovery":0.02,"popular_music_cover_band":0.05,"market_or_shop":0.02,"punk_metal_or_rock":0.04,"dance":0.03,"sales_related":0.14,"children_activity":0.02,"running":0.01,"exercise":0.01,"employment_related":0.01},"score":99,"rulesVersion":2},"price":"$10","registration":"http://www.michiganrhps.com","status":"scheduled","localityTier":"unknown"},{"legacyOccurrenceKeys":["edgefest-30-freedom-at-the-edge-the-rosc-event-2026-10-09|2026-10-09T00:00:00-04:00"],"legacySeriesKeys":["edgefest 30: freedom at the edge: the roscoe mitchell ensemble|detroit institute of arts (dia)"],"timePrecision":"date","id":"occ-d28105ea0e81db966db9f5b2","occurrenceId":"occ-d28105ea0e81db966db9f5b2","title":"Edgefest 30: Freedom at the Edge: The Roscoe Mitchell Ensemble","url":"https://dia.org/events/edgefest-30-freedom-edge-roscoe-mitchell-ensemble?ref=/node/62&event_date=2026-10-09","start":"2026-10-09T00:00:00-04:00","venue":"Detroit Institute of Arts (DIA)","city":"Detroit","category":"Music","summary":"A musical event featuring the Roscoe Mitchell Ensemble as part of Edgefest 30, celebrating freedom at the edge.","score":97,"scoring":{"signals":{"funny":0.08,"distinctive":0.7,"eclectic":0.73,"technical_science":0.04,"artsy":0.99,"progressive":0.9,"outdoors":0.02,"theatre":0.05,"live_music":0.97,"live_comedy":0.02,"farmer_market":0.01,"sporting":0.02,"recurring":0.25,"craft_fair_shopping":0.02,"religious":0.02,"large_venue":0.13,"substance_recovery":0.01,"popular_music_cover_band":0.04,"market_or_shop":0.02,"punk_metal_or_rock":0.06,"dance":0.02,"sales_related":0.16,"children_activity":0.03,"running":0.01,"exercise":0.01,"employment_related":0.01},"score":97,"rulesVersion":2},"registration":"https://dia.org/events/edgefest-30-freedom-edge-roscoe-mitchell-ensemble?ref=/node/62&event_date=2026-10-09","status":"scheduled","localityTier":"regional"},{"legacyOccurrenceKeys":["packard-farmers-market-event-2026-05-16|2026-05-16T09:00:00-04:00","src-7da8a8d5f6cc035fa1923322|2026-05-16T09:00:00-04:00"],"legacySeriesKeys":["packard farmers market|packard proving grounds historic site"],"timePrecision":"time","id":"occ-25d7ff707620ba57645bb988","occurrenceId":"occ-25d7ff707620ba57645bb988","title":"Packard Farmers Market","url":"https://community.metrotimes.com/event/packard-farmers-market-41215958","start":"2026-05-16T09:00:00-04:00","end":"2026-10-10T14:00:00-04:00","venue":"Packard Proving Grounds Historic Site","city":"Shelby charter Township","category":"Food","summary":"The Packard Farmers Market returns for the 2026 season at the historic Packard Proving Grounds, bringing together local farmers, artisans, bakers, makers, and small businesses in a one-of-a-kind setting where history and community meet. Formerly known as the Shelby Farmers Market, the newly rebranded Packard Farmers Market reflects its deep connection to the Packard Proving Grounds and its mission to support the preservation of this iconic historic site.","score":100,"scoring":{"signals":{"funny":0.08,"distinctive":0.82,"eclectic":0.45,"technical_science":0.12,"artsy":0.47,"progressive":0.25,"outdoors":0.71,"theatre":0.01,"live_music":0.02,"live_comedy":0.01,"farmer_market":0.84,"sporting":0.02,"recurring":0.79,"craft_fair_shopping":0.95,"religious":0.01,"large_venue":0.16,"substance_recovery":0.01,"popular_music_cover_band":0.02,"market_or_shop":0.98,"punk_metal_or_rock":0.01,"dance":0.01,"sales_related":0.29,"children_activity":0.06,"running":0.01,"exercise":0.01,"employment_related":0.02},"score":100,"rulesVersion":2},"price":"Free","registration":"https://eventvesta.com/events/134625/t/tickets","status":"scheduled","localityTier":"unknown"},{"legacyOccurrenceKeys":["30th-annual-edgefest-kerrytown-concert-h-event-2026-10-09|2026-10-09T18:00:00-04:00","src-77b1b75fde1b9214c35ed8b2|2026-10-09T18:00:00-04:00","src-b94c8e2d0bfd177e33f12f60|2026-10-09T18:00:00-04:00","src-c7049ca998e21782fad01ec1|2026-10-09T18:00:00-04:00"],"legacySeriesKeys":["30th annual edgefest: kerrytown concert house|kerrytown concert house","series-e6998de6320f78021217f588"],"timePrecision":"time","id":